Name,Address,Lat,Long,New
Main Campus,450 Brookline Ave Boston MA 02215,42.337462,-71.108186,N
Dana Farber Community Cancer Care Weymouth,51 performance Dr. weymouth ma 02189,42.1947,-70.943344,N
Dana Farber/ Brigham and Womens at Milford,20 prospect street Milford MA 01757,42.133008,-71.530044,N
Dana Farber/Brigham and Womens South Shore Hospital,101 Columbian St South Weymouth MA 02190,42.1771778,-70.9549961,N
Dana Farber Merrimack Valley,70 east st Methuen MA 01844,42.727627,-71.168367,Y
Dana-Farber Cancer Institute at St. Elizabeths medical center,"736 Cambridge St, Brighton MA 02135",42.35001,-71.156756,N
Dana Farber Chestnut Hill,"300 Boylston St, chestnut hill MA",42.318727,-71.180197,Y
